,tweet_id,in_reply_to_status_id,in_reply_to_user_id,timestamp,source,text,expanded_urls,rating_numerator,rating_denominator,name,dog_stage,retweet_count,favorite_count,jpg_url,img_num,p1,p1_conf,p1_dog,p2,p2_conf,p2_dog,p3,p3_conf,p3_dog
4805,743980027717509120,nan,nan,2016-06-18 01:33:55,Twitter for iPhone,This is Geno. He's a Wrinkled Baklavian Velveeta. Looks sad but that's just the extra skin. 11/10 would smoosh face https://t.co/Kxda28JmQ2,https://twitter.com/dog_rates/status/743980027717509120/photo/1,11.0,10.0,Geno,,1159,4354,https://pbs.twimg.com/media/ClMl4VLUYAA5qBb.jpg,1,bull_mastiff,0.97573,True,Rhodesian_ridgeback,0.00807261,True,pug,0.00557087,True
4817,743595368194129920,nan,nan,2016-06-17 00:05:25,Twitter for iPhone,This is Harold. He looks slippery af. Probably difficult to hug. Would still try tho. 7/10 great with kids I bet https://t.co/EVuqdEO66N,https://twitter.com/dog_rates/status/743595368194129920/photo/1,7.0,10.0,Harold,,7021,19314,https://pbs.twimg.com/media/ClHICHmXEAI_1PS.jpg,1,hippopotamus,0.505675,False,hog,0.370726,False,warthog,0.0188272,False
4825,743510151680958465,nan,nan,2016-06-16 18:26:48,Twitter Web Client,"This is Beya. She doesn't want to swim, so she's not going to. 13/10 nonconforming af (vid by @HappyTailsResor) https://t.co/qGeVjHSUKH",https://twitter.com/dog_rates/status/743510151680958465/video/1,13.0,10.0,Beya,,3945,8281,https://pbs.twimg.com/ext_tw_video_thumb/743509040018268160/pu/img/Ol2OgO5f8ciUp80r.jpg,1,sea_lion,0.8590459999999999,False,tub,0.0204054,False,hippopotamus,0.013094799999999998,False
4829,743253157753532416,nan,nan,2016-06-16 01:25:36,Twitter for iPhone,"This is Kilo. He cannot reach the snackum. Nifty tongue, but not nifty enough. 10/10 maybe one day puppo https://t.co/gSmp31Zrsx",https://twitter.com/dog_rates/status/743253157753532416/photo/1,10.0,10.0,Kilo,puppo,1301,4430,https://pbs.twimg.com/media/ClCQzFUUYAA5vAu.jpg,1,malamute,0.442612,True,Siberian_husky,0.368137,True,Eskimo_dog,0.177822,True
4833,743222593470234624,nan,nan,2016-06-15 23:24:09,Twitter for iPhone,This is a very rare Great Alaskan Bush Pupper. Hard to stumble upon without spooking. 12/10 would pet passionately https://t.co/xOBKCdpzaa,https://twitter.com/dog_rates/status/743222593470234624/photo/1,12.0,10.0,NaN,,2030,6477,https://pbs.twimg.com/media/ClB09z0WYAAA1jz.jpg,1,kuvasz,0.350629,True,soft-coated_wheaten_terrier,0.182782,True,golden_retriever,0.08766239999999999,True
4841,742528092657332225,nan,nan,2016-06-14 01:24:27,Twitter for iPhone,This is Maxaroni. He's pumped as hell for the summer. Been working on his beach bod for so long. 10/10 https://t.co/UHvjxm9B0O,"https://twitter.com/dog_rates/status/742528092657332225/photo/1,https://twitter.com/dog_rates/status/742528092657332225/photo/1",10.0,10.0,Maxaroni,,2126,4636,https://pbs.twimg.com/media/Ck39W0JWUAApgnH.jpg,2,sunglasses,0.900864,False,sunglass,0.0402906,False,snorkel,0.00933292,False
4842,742528092657332225,nan,nan,2016-06-14 01:24:27,Twitter for iPhone,This is Maxaroni. He's pumped as hell for the summer. Been working on his beach bod for so long. 10/10 https://t.co/UHvjxm9B0O,"https://twitter.com/dog_rates/status/742528092657332225/photo/1,https://twitter.com/dog_rates/status/742528092657332225/photo/1",10.0,10.0,Maxaroni,,2126,4635,https://pbs.twimg.com/media/Ck39W0JWUAApgnH.jpg,2,sunglasses,0.900864,False,sunglass,0.0402906,False,snorkel,0.00933292,False
4849,742423170473463808,nan,nan,2016-06-13 18:27:32,Twitter for iPhone,This is Bell. She likes holding hands. 12/10 would definitely pet with other hand https://t.co/BXIuvkQO9b,https://twitter.com/dog_rates/status/742423170473463808/photo/1,12.0,10.0,Bell,,4045,10286,https://pbs.twimg.com/media/Ck2d7tJWUAEPTL3.jpg,1,pug,0.99731,True,Brabancon_griffon,0.00118563,True,French_bulldog,0.000427989,True
4853,742385895052087300,nan,nan,2016-06-13 15:59:24,Twitter for iPhone,This is Phil. That's his comfort stick. He holds onto it whenever he's sad. 11/10 don't be sad Phil https://t.co/ULdPY6CLpq,https://twitter.com/dog_rates/status/742385895052087300/photo/1,11.0,10.0,Phil,,2120,7119,https://pbs.twimg.com/media/Ck18CFcXIAAUWoy.jpg,1,Cardigan,0.5669109999999999,True,Border_collie,0.117566,True,Appenzeller,0.047664,True
4857,742161199639494656,nan,nan,2016-06-13 01:06:33,Twitter for iPhone,This is Doug. He's trying to float away. 12/10 you got this Doug https://t.co/bZaHC3lvTL,https://twitter.com/dog_rates/status/742161199639494656/photo/1,12.0,10.0,Doug,,1466,4541,https://pbs.twimg.com/media/CkyvqnNWYAQxQY1.jpg,1,balloon,0.990736,False,punching_bag,0.00475356,False,parachute,0.000435974,False
4861,742150209887731712,nan,nan,2016-06-13 00:22:53,Twitter for iPhone,This is Edmund. He sends stellar selfies. Cute af. 8/10 would totally snapchat with this pupper https://t.co/PprXoqZuKY,https://twitter.com/dog_rates/status/742150209887731712/photo/1,8.0,10.0,Edmund,pupper,1662,5372,https://pbs.twimg.com/media/CkylrVWWsAAiXJE.jpg,1,Siamese_cat,0.112413,False,French_bulldog,0.07141439999999999,True,hog,0.0624654,False
4868,741793263812808706,nan,nan,2016-06-12 00:44:30,Twitter for iPhone,When your crush won't pay attention to you. Both 10/10 tragic af https://t.co/d3LELGVlqu,"https://twitter.com/dog_rates/status/741793263812808706/photo/1,https://twitter.com/dog_rates/status/741793263812808706/photo/1",10.0,10.0,NaN,,1607,4771,https://pbs.twimg.com/media/CkthBj7WgAAsIGb.jpg,1,kuvasz,0.311325,True,French_bulldog,0.115349,True,Labrador_retriever,0.0685335,True
4869,741743634094141440,nan,nan,2016-06-11 21:27:17,Twitter for iPhone,Meet Aqua. She's a sandy pupper. Not sure how she feels about being so sandy. Radical tongue slip. 11/10 petable af https://t.co/rYxJ0UQtbE,"https://twitter.com/dog_rates/status/741743634094141440/photo/1,https://twitter.com/dog_rates/status/741743634094141440/photo/1,https://twitter.com/dog_rates/status/741743634094141440/photo/1",11.0,10.0,Aqua,pupper,2946,8551,https://pbs.twimg.com/media/Cksz42EW0AAh2NF.jpg,1,Labrador_retriever,0.786089,True,flat-coated_retriever,0.0486524,True,Chesapeake_Bay_retriever,0.0346933,True
4881,741067306818797568,nan,nan,2016-06-10 00:39:48,Twitter for iPhone,This is just downright precious af. 12/10 for both pupper and doggo https://t.co/o5J479bZUC,https://twitter.com/dog_rates/status/741067306818797568/photo/1,12.0,10.0,NaN,pupper,3292,9884,https://pbs.twimg.com/media/CkjMx99UoAM2B1a.jpg,1,golden_retriever,0.843799,True,Labrador_retriever,0.0529559,True,kelpie,0.0357111,True
4897,740676976021798912,nan,nan,2016-06-08 22:48:46,Twitter for iPhone,"Meet Baloo. He's expecting a fast ground ball, hence the wide stance. Prepared af. 11/10 nothing runs like a pupper https://t.co/sMbMw5Z2XC",https://twitter.com/dog_rates/status/740676976021798912/photo/1,11.0,10.0,Baloo,pupper,7237,18985,https://pbs.twimg.com/media/Ckdpx5KWsAANF6b.jpg,1,wombat,0.462952,False,Norwegian_elkhound,0.275225,True,Siamese_cat,0.0435593,False
4898,740676976021798912,nan,nan,2016-06-08 22:48:46,Twitter for iPhone,"Meet Baloo. He's expecting a fast ground ball, hence the wide stance. Prepared af. 11/10 nothing runs like a pupper https://t.co/sMbMw5Z2XC",https://twitter.com/dog_rates/status/740676976021798912/photo/1,11.0,10.0,Baloo,pupper,7236,18983,https://pbs.twimg.com/media/Ckdpx5KWsAANF6b.jpg,1,wombat,0.462952,False,Norwegian_elkhound,0.275225,True,Siamese_cat,0.0435593,False
4901,740373189193256964,nan,nan,2016-06-08 02:41:38,Twitter for iPhone,"After so many requests, this is Bretagne. She was the last surviving 9/11 search dog, and our second ever 14/10. RIP https://t.co/XAVDNDaVgQ","https://twitter.com/dog_rates/status/740373189193256964/photo/1,https://twitter.com/dog_rates/status/740373189193256964/photo/1,https://twitter.com/dog_rates/status/740373189193256964/photo/1,https://twitter.com/dog_rates/status/740373189193256964/photo/1",14.0,10.0,NaN,,14168,36384,https://pbs.twimg.com/media/CkZVdJ6WYAAXZ5A.jpg,3,golden_retriever,0.8076439999999999,True,kuvasz,0.101286,True,Labrador_retriever,0.0237853,True
4913,740214038584557568,nan,nan,2016-06-07 16:09:13,Twitter for iPhone,This is getting incredibly frustrating. This is a Mexican Golden Beaver. We only rate dogs. Only send dogs ...10/10 https://t.co/0yolOOyD3X,https://twitter.com/dog_rates/status/740214038584557568/photo/1,10.0,10.0,NaN,,2093,6998,https://pbs.twimg.com/media/CkXEu2OUoAAs8yU.jpg,1,Chesapeake_Bay_retriever,0.586414,True,Labrador_retriever,0.189782,True,vizsla,0.0676072,True
4917,739979191639244800,nan,nan,2016-06-07 00:36:02,Twitter for iPhone,This is Nollie. She's waving at you. If you don't wave back you're a monster. She's also portable as hell. 12/10 https://t.co/7AKdkCOlMf,https://twitter.com/dog_rates/status/739979191639244800/photo/1,12.0,10.0,Nollie,,6309,20871,https://pbs.twimg.com/media/CkTvJTdXAAAEfbT.jpg,1,Irish_water_spaniel,0.2858,True,wig,0.24065300000000006,False,toy_poodle,0.07491389999999999,True
4925,739844404073074688,nan,nan,2016-06-06 15:40:26,Twitter for iPhone,This is Simba. He's the grand prize. The trophy is just for participation. 12/10 would pet so damn well https://t.co/4qiuC0lXq5,https://twitter.com/dog_rates/status/739844404073074688/photo/1,12.0,10.0,Simba,,910,3964,https://pbs.twimg.com/media/CkR0jrhWYAALL5N.jpg,1,toy_poodle,0.342397,True,table_lamp,0.104451,False,miniature_poodle,0.079871,True
4933,739544079319588864,nan,nan,2016-06-05 19:47:03,Twitter for iPhone,This... is a Tyrannosaurus rex. We only rate dogs. Please only send in dogs. Thank you ...10/10 https://t.co/zxw8d5g94P,https://twitter.com/dog_rates/status/739544079319588864/photo/1,10.0,10.0,NaN,,22784,41481,https://pbs.twimg.com/media/CkNjahBXAAQ2kWo.jpg,1,Labrador_retriever,0.967397,True,golden_retriever,0.0166414,True,ice_bear,0.0148576,False
4934,739544079319588864,nan,nan,2016-06-05 19:47:03,Twitter for iPhone,This... is a Tyrannosaurus rex. We only rate dogs. Please only send in dogs. Thank you ...10/10 https://t.co/zxw8d5g94P,https://twitter.com/dog_rates/status/739544079319588864/photo/1,10.0,10.0,NaN,,22780,41476,https://pbs.twimg.com/media/CkNjahBXAAQ2kWo.jpg,1,Labrador_retriever,0.967397,True,golden_retriever,0.0166414,True,ice_bear,0.0148576,False
4937,739485634323156992,nan,nan,2016-06-05 15:54:48,Twitter for iPhone,This is Kyle. He's a heavy drinker and an avid pot user. Just wants to be pupular. 6/10 I can't support this Kyle https://t.co/rRULp7XFnO,"https://twitter.com/dog_rates/status/739485634323156992/photo/1,https://twitter.com/dog_rates/status/739485634323156992/photo/1",6.0,10.0,Kyle,,3131,7515,https://pbs.twimg.com/media/CkMuP7SWkAAD-2R.jpg,2,Walker_hound,0.640256,True,English_foxhound,0.229799,True,beagle,0.037754,True
4938,739485634323156992,nan,nan,2016-06-05 15:54:48,Twitter for iPhone,This is Kyle. He's a heavy drinker and an avid pot user. Just wants to be pupular. 6/10 I can't support this Kyle https://t.co/rRULp7XFnO,"https://twitter.com/dog_rates/status/739485634323156992/photo/1,https://twitter.com/dog_rates/status/739485634323156992/photo/1",6.0,10.0,Kyle,,3131,7516,https://pbs.twimg.com/media/CkMuP7SWkAAD-2R.jpg,2,Walker_hound,0.640256,True,English_foxhound,0.229799,True,beagle,0.037754,True
4939,739485634323156992,nan,nan,2016-06-05 15:54:48,Twitter for iPhone,This is Kyle. He's a heavy drinker and an avid pot user. Just wants to be pupular. 6/10 I can't support this Kyle https://t.co/rRULp7XFnO,"https://twitter.com/dog_rates/status/739485634323156992/photo/1,https://twitter.com/dog_rates/status/739485634323156992/photo/1",6.0,10.0,Kyle,,3130,7516,https://pbs.twimg.com/media/CkMuP7SWkAAD-2R.jpg,2,Walker_hound,0.640256,True,English_foxhound,0.229799,True,beagle,0.037754,True
4940,739485634323156992,nan,nan,2016-06-05 15:54:48,Twitter for iPhone,This is Kyle. He's a heavy drinker and an avid pot user. Just wants to be pupular. 6/10 I can't support this Kyle https://t.co/rRULp7XFnO,"https://twitter.com/dog_rates/status/739485634323156992/photo/1,https://twitter.com/dog_rates/status/739485634323156992/photo/1",6.0,10.0,Kyle,,3130,7517,https://pbs.twimg.com/media/CkMuP7SWkAAD-2R.jpg,2,Walker_hound,0.640256,True,English_foxhound,0.229799,True,beagle,0.037754,True
4941,739238157791694849,nan,nan,2016-06-04 23:31:25,Twitter for iPhone,Here's a doggo blowing bubbles. It's downright legendary. 13/10 would watch on repeat forever (vid by Kent Duryee) https://t.co/YcXgHfp1EC,https://twitter.com/dog_rates/status/739238157791694849/video/1,13.0,10.0,NaN,doggo,61838,121203,https://pbs.twimg.com/ext_tw_video_thumb/739238016737267712/pu/img/-tLpyiuIzD5zR1et.jpg,1,Eskimo_dog,0.503372,True,Siberian_husky,0.390413,True,malamute,0.08090119999999999,True
4944,739238157791694849,nan,nan,2016-06-04 23:31:25,Twitter for iPhone,Here's a doggo blowing bubbles. It's downright legendary. 13/10 would watch on repeat forever (vid by Kent Duryee) https://t.co/YcXgHfp1EC,https://twitter.com/dog_rates/status/739238157791694849/video/1,13.0,10.0,NaN,doggo,61831,121200,https://pbs.twimg.com/ext_tw_video_thumb/739238016737267712/pu/img/-tLpyiuIzD5zR1et.jpg,1,Eskimo_dog,0.503372,True,Siberian_husky,0.390413,True,malamute,0.08090119999999999,True
4945,738885046782832640,nan,nan,2016-06-04 00:08:17,Twitter for iPhone,This is Charles. He's a Nova Scotian Towel Pouncer. Deadly af. Nifty tongue slip. 11/10 would pet with caution https://t.co/EfejX3iRGr,https://twitter.com/dog_rates/status/738885046782832640/photo/1,11.0,10.0,Charles,,1216,3935,https://pbs.twimg.com/media/CkEMBz9WYAAGLaa.jpg,1,bath_towel,0.8783200000000001,False,swab,0.0206333,False,American_Staffordshire_terrier,0.0155351,True
4953,738537504001953792,nan,nan,2016-06-03 01:07:16,Twitter for iPhone,This is Bayley. She fell asleep trying to escape her evil fence enclosure. 11/10 night night puppo https://t.co/AxSiqAKEKu,"https://twitter.com/dog_rates/status/738537504001953792/photo/1,https://twitter.com/dog_rates/status/738537504001953792/photo/1",11.0,10.0,Bayley,puppo,1662,5322,https://pbs.twimg.com/media/Cj_P7rSUgAAYQbz.jpg,1,chow,0.808737,True,gibbon,0.028942400000000007,False,Pembroke,0.026497900000000005,True
4961,738184450748633089,nan,nan,2016-06-02 01:44:22,Twitter for iPhone,"For the last time, we only rate dogs. Pls stop sending other animals like this Duck-Billed Platypus. Thank you. 9/10 https://t.co/twxYcPOafl",https://twitter.com/dog_rates/status/738184450748633089/photo/1,9.0,10.0,NaN,,1284,4496,https://pbs.twimg.com/media/Cj6O1G9UYAAIU-1.jpg,1,Bedlington_terrier,0.289471,True,standard_poodle,0.17368499999999998,True,Great_Pyrenees,0.157081,True
4965,738166403467907072,nan,nan,2016-06-02 00:32:39,Twitter for iPhone,This is Axel. He's a professional leaf catcher. 12/10 gifted af https://t.co/P8bgOMMTRs,"https://twitter.com/dog_rates/status/738166403467907072/photo/1,https://twitter.com/dog_rates/status/738166403467907072/photo/1,https://twitter.com/dog_rates/status/738166403467907072/photo/1,https://twitter.com/dog_rates/status/738166403467907072/photo/1",12.0,10.0,Axel,,3623,9196,https://pbs.twimg.com/media/Cj5-aUQUgAAb43p.jpg,2,keeshond,0.8788860000000001,True,Norwegian_elkhound,0.0866594,True,malamute,0.0212803,True
4974,737826014890496000,nan,nan,2016-06-01 02:00:04,Twitter for iPhone,This is Remy. He has some long ass ears (probably magical). Also very proud of broken stick. 10/10 such a good boy https://t.co/EZx0YjPjPK,"https://twitter.com/dog_rates/status/737826014890496000/photo/1,https://twitter.com/dog_rates/status/737826014890496000/photo/1",10.0,10.0,Remy,,1873,5503,https://pbs.twimg.com/media/Cj1I1fbWYAAOwff.jpg,1,vizsla,0.990391,True,Rhodesian_ridgeback,0.00560474,True,Chesapeake_Bay_retriever,0.00286936,True
4977,737800304142471168,nan,nan,2016-06-01 00:17:54,Twitter for iPhone,This is Bella. She's ubering home after a few too many drinks. 10/10 socially conscious af https://t.co/KxkOgq80Xj,https://twitter.com/dog_rates/status/737800304142471168/photo/1,10.0,10.0,Bella,,3682,10441,https://pbs.twimg.com/media/Cj0xdMBVAAEbDHp.jpg,1,malamute,0.374682,True,Norwegian_elkhound,0.334853,True,limousine,0.0681732,False
4985,737445876994609152,nan,nan,2016-05-31 00:49:32,Twitter for iPhone,Just wanted to share this super rare Rainbow Floofer in case you guys haven't seen it yet. 13/10 colorful af https://t.co/CaG9MzD3WT,https://twitter.com/dog_rates/status/737445876994609152/photo/1,13.0,10.0,NaN,,4752,10744,https://pbs.twimg.com/media/CjvvHBwUoAE55WZ.jpg,1,Samoyed,0.400568,True,Pomeranian,0.331268,True,Maltese_dog,0.0454261,True
4993,737310737551491075,nan,nan,2016-05-30 15:52:33,Twitter for iPhone,Everybody stop what you're doing and watch these puppers enjoy summer. Both 13/10 https://t.co/wvjqSCN6iC,https://twitter.com/dog_rates/status/737310737551491075/video/1,13.0,10.0,NaN,pupper,7896,15338,https://pbs.twimg.com/ext_tw_video_thumb/737310236135043073/pu/img/_lG4DXmH-_XEq7Rc.jpg,1,cliff,0.4390770000000001,False,lakeside,0.0628992,False,valley,0.0397585,False
4994,737310737551491075,nan,nan,2016-05-30 15:52:33,Twitter for iPhone,Everybody stop what you're doing and watch these puppers enjoy summer. Both 13/10 https://t.co/wvjqSCN6iC,https://twitter.com/dog_rates/status/737310737551491075/video/1,13.0,10.0,NaN,pupper,7896,15336,https://pbs.twimg.com/ext_tw_video_thumb/737310236135043073/pu/img/_lG4DXmH-_XEq7Rc.jpg,1,cliff,0.4390770000000001,False,lakeside,0.0628992,False,valley,0.0397585,False
5012,736010884653420544,nan,nan,2016-05-27 01:47:23,Twitter for iPhone,Right after you graduate vs when you remember you're on your own now and can barely work a washing machine ...10/10 https://t.co/O1TLuYjsNS,"https://twitter.com/dog_rates/status/736010884653420544/photo/1,https://twitter.com/dog_rates/status/736010884653420544/photo/1",10.0,10.0,NaN,,3162,8237,https://pbs.twimg.com/media/CjbV-lEWgAAr6WY.jpg,2,golden_retriever,0.553901,True,Labrador_retriever,0.119475,True,bluetick,0.077475,True
5021,735635087207878657,nan,nan,2016-05-26 00:54:06,Twitter for iPhone,This is Dakota. He hasn't grow into his skin yet. 11/10 would squeeze softly https://t.co/IvFSlNXpgj,"https://twitter.com/dog_rates/status/735635087207878657/photo/1,https://twitter.com/dog_rates/status/735635087207878657/photo/1",11.0,10.0,Dakota,,2496,6451,https://pbs.twimg.com/media/CjWANBlVAAAaN-a.jpg,1,pug,0.8918709999999999,True,goose,0.0143766,False,fur_coat,0.00845143,False
5029,735256018284875776,nan,nan,2016-05-24 23:47:49,Twitter for iPhone,This is Kellogg. He accidentally opened the front facing camera. 8/10 get it together doggo https://t.co/MRYv7nDPyS,https://twitter.com/dog_rates/status/735256018284875776/photo/1,8.0,10.0,Kellogg,doggo,942,3488,https://pbs.twimg.com/media/CjQnclkVEAA4pnK.jpg,1,Staffordshire_bullterrier,0.523191,True,French_bulldog,0.351104,True,doormat,0.0280753,False
5037,734912297295085568,nan,nan,2016-05-24 01:02:00,Twitter for iPhone,This is Jax. He's a literal fluffball. Sneaky tongue slip. 10/10 would pet nonstop https://t.co/9MGouPwQmK,https://twitter.com/dog_rates/status/734912297295085568/photo/1,10.0,10.0,Jax,,548,2853,https://pbs.twimg.com/media/CjLuzPvUoAAbU5k.jpg,1,Maltese_dog,0.847292,True,feather_boa,0.0593786,False,Old_English_sheepdog,0.052758000000000006,True
5041,734787690684657664,nan,nan,2016-05-23 16:46:51,Twitter for iPhone,This dog is more successful than I will ever be. 13/10 absolute legend https://t.co/BPoaHySYwA,"https://twitter.com/dog_rates/status/734787690684657664/photo/1,https://twitter.com/dog_rates/status/734787690684657664/photo/1,https://twitter.com/dog_rates/status/734787690684657664/photo/1,https://twitter.com/dog_rates/status/734787690684657664/photo/1",13.0,10.0,NaN,,6690,13108,https://pbs.twimg.com/media/CjJ9gQ1WgAAXQtJ.jpg,4,golden_retriever,0.883991,True,chow,0.0235416,True,Labrador_retriever,0.0160559,True
5053,733822306246479872,nan,nan,2016-05-21 00:50:46,Twitter for iPhone,This is Moose. He's a Polynesian Floofer. Dapper af. 10/10 would pet diligently https://t.co/mVfqRdppTL,https://twitter.com/dog_rates/status/733822306246479872/photo/1,10.0,10.0,Moose,,1071,3822,https://pbs.twimg.com/media/Ci8Pfg_UUAA2m9i.jpg,1,Lhasa,0.457356,True,Shih-Tzu,0.371282,True,Tibetan_terrier,0.048359,True
5065,733109485275860992,nan,nan,2016-05-19 01:38:16,Twitter for iPhone,"Like father (doggo), like son (pupper). Both 12/10 https://t.co/pG2inLaOda",https://twitter.com/dog_rates/status/733109485275860992/photo/1,12.0,10.0,NaN,doggo,17860,51394,https://pbs.twimg.com/media/CiyHLocU4AI2pJu.jpg,1,golden_retriever,0.945523,True,Labrador_retriever,0.0423191,True,doormat,0.00395626,False
5066,733109485275860992,nan,nan,2016-05-19 01:38:16,Twitter for iPhone,"Like father (doggo), like son (pupper). Both 12/10 https://t.co/pG2inLaOda",https://twitter.com/dog_rates/status/733109485275860992/photo/1,12.0,10.0,NaN,doggo,17859,51397,https://pbs.twimg.com/media/CiyHLocU4AI2pJu.jpg,1,golden_retriever,0.945523,True,Labrador_retriever,0.0423191,True,doormat,0.00395626,False
5067,733109485275860992,nan,nan,2016-05-19 01:38:16,Twitter for iPhone,"Like father (doggo), like son (pupper). Both 12/10 https://t.co/pG2inLaOda",https://twitter.com/dog_rates/status/733109485275860992/photo/1,12.0,10.0,NaN,doggo,17856,51397,https://pbs.twimg.com/media/CiyHLocU4AI2pJu.jpg,1,golden_retriever,0.945523,True,Labrador_retriever,0.0423191,True,doormat,0.00395626,False
5068,733109485275860992,nan,nan,2016-05-19 01:38:16,Twitter for iPhone,"Like father (doggo), like son (pupper). Both 12/10 https://t.co/pG2inLaOda",https://twitter.com/dog_rates/status/733109485275860992/photo/1,12.0,10.0,NaN,doggo,17856,51398,https://pbs.twimg.com/media/CiyHLocU4AI2pJu.jpg,1,golden_retriever,0.945523,True,Labrador_retriever,0.0423191,True,doormat,0.00395626,False
5077,732585889486888962,nan,nan,2016-05-17 14:57:41,Twitter for iPhone,"When your teacher agreed on 10,000 RTs and no final but after 24 hours you only have 37... 10/10 https://t.co/sVnJfWVjUp","https://twitter.com/dog_rates/status/732585889486888962/photo/1,https://twitter.com/dog_rates/status/732585889486888962/photo/1",10.0,10.0,NaN,,820,3843,https://pbs.twimg.com/media/Ciqq-VFUUAANlWm.jpg,2,Staffordshire_bullterrier,0.843359,True,American_Staffordshire_terrier,0.0282903,True,miniature_pinscher,0.0167929,True
5085,732005617171337216,nan,nan,2016-05-16 00:31:53,Twitter for iPhone,This is Larry. He has no self control. Tongue still nifty af tho 11/10 https://t.co/ghyT4Ubk1r,"https://twitter.com/dog_rates/status/732005617171337216/photo/1,https://twitter.com/dog_rates/status/732005617171337216/photo/1",11.0,10.0,Larry,,5804,15582,https://pbs.twimg.com/media/CiibOMzUYAA9Mxz.jpg,1,English_setter,0.677408,True,Border_collie,0.052724,True,cocker_spaniel,0.0485719,True
5086,732005617171337216,nan,nan,2016-05-16 00:31:53,Twitter for iPhone,This is Larry. He has no self control. Tongue still nifty af tho 11/10 https://t.co/ghyT4Ubk1r,"https://twitter.com/dog_rates/status/732005617171337216/photo/1,https://twitter.com/dog_rates/status/732005617171337216/photo/1",11.0,10.0,Larry,,5804,15580,https://pbs.twimg.com/media/CiibOMzUYAA9Mxz.jpg,1,English_setter,0.677408,True,Border_collie,0.052724,True,cocker_spaniel,0.0485719,True
5097,730924654643314689,nan,nan,2016-05-13 00:56:32,Twitter for iPhone,We only rate dogs. Pls stop sending non-canines like this Bulgarian Eyeless Porch Bear. This is unacceptable... 9/10 https://t.co/2yctWAUZ3Z,https://twitter.com/dog_rates/status/730924654643314689/photo/1,9.0,10.0,NaN,,2103,6389,https://pbs.twimg.com/media/CiTEFjDXAAAqU6I.jpg,1,polecat,0.185382,False,mink,0.105282,False,Newfoundland,0.0862411,True
5153,728409960103686147,nan,nan,2016-05-06 02:24:02,Twitter for iPhone,This is Wallace. He's a skater pup. He said see ya later pup. Can easily do a kick flip. Gnarly af. 10/10 v petable https://t.co/5i8fORVKgr,https://twitter.com/dog_rates/status/728409960103686147/photo/1,10.0,10.0,Wallace,,2127,5116,https://pbs.twimg.com/media/ChvU_DwWMAArx5L.jpg,1,Siamese_cat,0.478278,False,Saint_Bernard,0.0942456,True,king_penguin,0.0821567,False
5161,728046963732717569,nan,nan,2016-05-05 02:21:37,Twitter for iPhone,This is Raymond. He controls fountains with his tongue. 11/10 pretty damn magical https://t.co/9aMxSbOaAZ,https://twitter.com/dog_rates/status/728046963732717569/photo/1,11.0,10.0,Raymond,,1248,4487,https://pbs.twimg.com/media/ChqK2cVWMAAE5Zj.jpg,1,Newfoundland,0.255971,True,groenendael,0.175583,True,German_shepherd,0.164135,True
5165,728035342121635841,nan,nan,2016-05-05 01:35:26,Twitter for iPhone,This is all I want in my life. 12/10 for super sleepy pupper https://t.co/4RlLA5ObMh,"https://twitter.com/dog_rates/status/728035342121635841/photo/1,https://twitter.com/dog_rates/status/728035342121635841/photo/1",12.0,10.0,NaN,pupper,1770,4741,https://pbs.twimg.com/media/ChqARqmWsAEI6fB.jpg,1,handkerchief,0.30296100000000004,False,Pomeranian,0.248664,True,Shih-Tzu,0.111015,True
5169,728015554473250816,nan,nan,2016-05-05 00:16:48,Twitter for iPhone,This is Rueben. He has reached ultimate pupper zen state. 11/10 tranquil af https://t.co/Z167HgtnBi,https://twitter.com/dog_rates/status/728015554473250816/photo/1,11.0,10.0,Rueben,pupper,1161,4263,https://pbs.twimg.com/media/ChpuRyvVAAARMoq.jpg,1,cocker_spaniel,0.384559,True,golden_retriever,0.091661,True,sandbar,0.0817989,False
5172,728015554473250816,nan,nan,2016-05-05 00:16:48,Twitter for iPhone,This is Rueben. He has reached ultimate pupper zen state. 11/10 tranquil af https://t.co/Z167HgtnBi,https://twitter.com/dog_rates/status/728015554473250816/photo/1,11.0,10.0,Rueben,pupper,1161,4265,https://pbs.twimg.com/media/ChpuRyvVAAARMoq.jpg,1,cocker_spaniel,0.384559,True,golden_retriever,0.091661,True,sandbar,0.0817989,False
