,tweet_id,in_reply_to_status_id,in_reply_to_user_id,timestamp,source,text,expanded_urls,rating_numerator,rating_denominator,name,dog_stage,retweet_count,favorite_count,jpg_url,img_num,p1,p1_conf,p1_dog,p2,p2_conf,p2_dog,p3,p3_conf,p3_dog
0,892420643555336193,nan,nan,2017-08-01 16:23:56,Twitter for iPhone,This is Phineas. He's a mystical boy. Only ever appears in the hole of a donut. 13/10 https://t.co/MgUWQ76dJU,https://twitter.com/dog_rates/status/892420643555336193/photo/1,13.0,10.0,Phineas,,8303,37993,https://pbs.twimg.com/media/DGKD1-bXoAAIAUK.jpg,1,orange,0.0970486,False,bagel,0.08585110000000001,False,banana,0.07611,False
1,892420643555336193,nan,nan,2017-08-01 16:23:56,Twitter for iPhone,This is Phineas. He's a mystical boy. Only ever appears in the hole of a donut. 13/10 https://t.co/MgUWQ76dJU,https://twitter.com/dog_rates/status/892420643555336193/photo/1,13.0,10.0,Phineas,,8304,37989,https://pbs.twimg.com/media/DGKD1-bXoAAIAUK.jpg,1,orange,0.0970486,False,bagel,0.08585110000000001,False,banana,0.07611,False
4,892420643555336193,nan,nan,2017-08-01 16:23:56,Twitter for iPhone,This is Phineas. He's a mystical boy. Only ever appears in the hole of a donut. 13/10 https://t.co/MgUWQ76dJU,https://twitter.com/dog_rates/status/892420643555336193/photo/1,13.0,10.0,Phineas,,8298,37982,https://pbs.twimg.com/media/DGKD1-bXoAAIAUK.jpg,1,orange,0.0970486,False,bagel,0.08585110000000001,False,banana,0.07611,False
10,892177421306343426,nan,nan,2017-08-01 00:17:27,Twitter for iPhone,"This is Tilly. She's just checking pup on you. Hopes you're doing ok. If not, she's available for pats, snugs, boops, the whole bit. 13/10 https://t.co/0Xxu71qeIV",https://twitter.com/dog_rates/status/892177421306343426/photo/1,13.0,10.0,Tilly,,6126,32610,https://pbs.twimg.com/media/DGGmoV4XsAAUL6n.jpg,1,Chihuahua,0.323581,True,Pekinese,0.0906465,True,papillon,0.0689569,True
14,891815181378084864,nan,nan,2017-07-31 00:18:03,Twitter for iPhone,This is Archie. He is a rare Norwegian Pouncing Corgo. Lives in the tall grass. You never know when one may strike. 12/10 https://t.co/wUnZnhtVJB,https://twitter.com/dog_rates/status/891815181378084864/photo/1,12.0,10.0,Archie,,4061,24554,https://pbs.twimg.com/media/DGBdLU1WsAANxJ9.jpg,1,Chihuahua,0.716012,True,malamute,0.078253,True,kelpie,0.0313789,True
16,891815181378084864,nan,nan,2017-07-31 00:18:03,Twitter for iPhone,This is Archie. He is a rare Norwegian Pouncing Corgo. Lives in the tall grass. You never know when one may strike. 12/10 https://t.co/wUnZnhtVJB,https://twitter.com/dog_rates/status/891815181378084864/photo/1,12.0,10.0,Archie,,4056,24557,https://pbs.twimg.com/media/DGBdLU1WsAANxJ9.jpg,1,Chihuahua,0.716012,True,malamute,0.078253,True,kelpie,0.0313789,True
21,891689557279858688,nan,nan,2017-07-30 15:58:51,Twitter for iPhone,This is Darla. She commenced a snooze mid meal. 13/10 happens to the best of us https://t.co/tD36da7qLQ,https://twitter.com/dog_rates/status/891689557279858688/photo/1,13.0,10.0,Darla,,8446,41334,https://pbs.twimg.com/media/DF_q7IAWsAEuuN8.jpg,1,paper_towel,0.17027799999999998,False,Labrador_retriever,0.168086,True,spatula,0.0408359,False
22,891689557279858688,nan,nan,2017-07-30 15:58:51,Twitter for iPhone,This is Darla. She commenced a snooze mid meal. 13/10 happens to the best of us https://t.co/tD36da7qLQ,https://twitter.com/dog_rates/status/891689557279858688/photo/1,13.0,10.0,Darla,,8438,41310,https://pbs.twimg.com/media/DF_q7IAWsAEuuN8.jpg,1,paper_towel,0.17027799999999998,False,Labrador_retriever,0.168086,True,spatula,0.0408359,False
28,891327558926688256,nan,nan,2017-07-29 16:00:24,Twitter for iPhone,"This is Franklin. He would like you to stop calling him ""cute."" He is a very fierce shark and should be respected as such. 12/10 #BarkWeek https://t.co/AtUZn91f7f","https://twitter.com/dog_rates/status/891327558926688256/photo/1,https://twitter.com/dog_rates/status/891327558926688256/photo/1",12.0,10.0,Franklin,,9138,39504,https://pbs.twimg.com/media/DF6hr6BUMAAzZgT.jpg,2,basset,0.555712,True,English_springer,0.22577,True,German_short-haired_pointer,0.175219,True
34,891087950875897856,nan,nan,2017-07-29 00:08:17,Twitter for iPhone,Here we have a majestic great white breaching off South Africa's coast. Absolutely h*ckin breathtaking. 13/10 (IG: tucker_marlo) #BarkWeek https://t.co/kQ04fDDRmh,https://twitter.com/dog_rates/status/891087950875897856/photo/1,13.0,10.0,NaN,,3042,19851,https://pbs.twimg.com/media/DF3HwyEWsAABqE6.jpg,1,Chesapeake_Bay_retriever,0.425595,True,Irish_terrier,0.116317,True,Indian_elephant,0.07690219999999999,False
40,890971913173991426,nan,nan,2017-07-28 16:27:12,Twitter for iPhone,"Meet Jax. He enjoys ice cream so much he gets nervous around it. 13/10 help Jax enjoy more things by clicking below

https://t.co/Zr4hWfAs1H https://t.co/tVJBRMnhxl","https://gofundme.com/ydvmve-surgery-for-jax,https://twitter.com/dog_rates/status/890971913173991426/photo/1",13.0,10.0,Jax,,2013,11599,https://pbs.twimg.com/media/DF1eOmZXUAALUcq.jpg,1,Appenzeller,0.34170300000000003,True,Border_collie,0.199287,True,ice_lolly,0.193548,False
45,890729181411237888,nan,nan,2017-07-28 00:22:40,Twitter for iPhone,When you watch your owner call another dog a good boy but then they turn back to you and say you're a great boy. 13/10 https://t.co/v0nONBcwxq,"https://twitter.com/dog_rates/status/890729181411237888/photo/1,https://twitter.com/dog_rates/status/890729181411237888/photo/1",13.0,10.0,NaN,,18420,64090,https://pbs.twimg.com/media/DFyBahAVwAAhUTd.jpg,2,Pomeranian,0.566142,True,Eskimo_dog,0.17840599999999998,True,Pembroke,0.0765069,True
46,890729181411237888,nan,nan,2017-07-28 00:22:40,Twitter for iPhone,When you watch your owner call another dog a good boy but then they turn back to you and say you're a great boy. 13/10 https://t.co/v0nONBcwxq,"https://twitter.com/dog_rates/status/890729181411237888/photo/1,https://twitter.com/dog_rates/status/890729181411237888/photo/1",13.0,10.0,NaN,,18402,64060,https://pbs.twimg.com/media/DFyBahAVwAAhUTd.jpg,2,Pomeranian,0.566142,True,Eskimo_dog,0.17840599999999998,True,Pembroke,0.0765069,True
49,890609185150312448,nan,nan,2017-07-27 16:25:51,Twitter for iPhone,This is Zoey. She doesn't want to be one of the scary sharks. Just wants to be a snuggly pettable boatpet. 13/10 #BarkWeek https://t.co/9TwLuAGH0b,https://twitter.com/dog_rates/status/890609185150312448/photo/1,13.0,10.0,Zoey,,4179,27269,https://pbs.twimg.com/media/DFwUU__XcAEpyXI.jpg,1,Irish_terrier,0.487574,True,Irish_setter,0.193054,True,Chesapeake_Bay_retriever,0.118184,True
52,890609185150312448,nan,nan,2017-07-27 16:25:51,Twitter for iPhone,This is Zoey. She doesn't want to be one of the scary sharks. Just wants to be a snuggly pettable boatpet. 13/10 #BarkWeek https://t.co/9TwLuAGH0b,https://twitter.com/dog_rates/status/890609185150312448/photo/1,13.0,10.0,Zoey,,4176,27263,https://pbs.twimg.com/media/DFwUU__XcAEpyXI.jpg,1,Irish_terrier,0.487574,True,Irish_setter,0.193054,True,Chesapeake_Bay_retriever,0.118184,True
57,890240255349198849,nan,nan,2017-07-26 15:59:51,Twitter for iPhone,This is Cassie. She is a college pup. Studying international doggo communication and stick theory. 14/10 so elegant much sophisticate https://t.co/t1bfwz5S2A,https://twitter.com/dog_rates/status/890240255349198849/photo/1,14.0,10.0,Cassie,doggo,7207,31288,https://pbs.twimg.com/media/DFrEyVuW0AAO3t9.jpg,1,Pembroke,0.511319,True,Cardigan,0.451038,True,Chihuahua,0.0292482,True
58,890240255349198849,nan,nan,2017-07-26 15:59:51,Twitter for iPhone,This is Cassie. She is a college pup. Studying international doggo communication and stick theory. 14/10 so elegant much sophisticate https://t.co/t1bfwz5S2A,https://twitter.com/dog_rates/status/890240255349198849/photo/1,14.0,10.0,Cassie,doggo,7198,31284,https://pbs.twimg.com/media/DFrEyVuW0AAO3t9.jpg,1,Pembroke,0.511319,True,Cardigan,0.451038,True,Chihuahua,0.0292482,True
64,890006608113172480,nan,nan,2017-07-26 00:31:25,Twitter for iPhone,This is Koda. He is a South Australian deckshark. Deceptively deadly. Frighteningly majestic. 13/10 would risk a petting #BarkWeek https://t.co/dVPW0B0Mme,"https://twitter.com/dog_rates/status/890006608113172480/photo/1,https://twitter.com/dog_rates/status/890006608113172480/photo/1",13.0,10.0,Koda,,7154,30056,https://pbs.twimg.com/media/DFnwSY4WAAAMliS.jpg,1,Samoyed,0.957979,True,Pomeranian,0.0138835,True,chow,0.00816748,True
70,889880896479866881,nan,nan,2017-07-25 16:11:53,Twitter for iPhone,This is Bruno. He is a service shark. Only gets out of the water to assist you. 13/10 terrifyingly good boy https://t.co/u1XPQMl29g,https://twitter.com/dog_rates/status/889880896479866881/photo/1,13.0,10.0,Bruno,,4856,27262,https://pbs.twimg.com/media/DFl99B1WsAITKsg.jpg,1,French_bulldog,0.377417,True,Labrador_retriever,0.151317,True,muzzle,0.0829811,False
76,889665388333682689,nan,nan,2017-07-25 01:55:32,Twitter for iPhone,Here's a puppo that seems to be on the fence about something haha no but seriously someone help her. 13/10 https://t.co/BxvuXk0UCm,https://twitter.com/dog_rates/status/889665388333682689/photo/1,13.0,10.0,NaN,puppo,9795,47169,https://pbs.twimg.com/media/DFi579UWsAAatzw.jpg,1,Pembroke,0.966327,True,Cardigan,0.0273557,True,basenji,0.00463323,True
82,889638837579907072,nan,nan,2017-07-25 00:10:02,Twitter for iPhone,This is Ted. He does his best. Sometimes that's not enough. But it's ok. 12/10 would assist https://t.co/f8dEDcrKSR,"https://twitter.com/dog_rates/status/889638837579907072/photo/1,https://twitter.com/dog_rates/status/889638837579907072/photo/1",12.0,10.0,Ted,,4417,26612,https://pbs.twimg.com/media/DFihzFfXsAYGDPR.jpg,1,French_bulldog,0.99165,True,boxer,0.00212864,True,Staffordshire_bullterrier,0.00149818,True
88,889531135344209921,nan,nan,2017-07-24 17:02:04,Twitter for iPhone,This is Stuart. He's sporting his favorite fanny pack. Secretly filled with bones only. 13/10 puppared puppo #BarkWeek https://t.co/y70o6h3isq,https://twitter.com/dog_rates/status/889531135344209921/photo/1,13.0,10.0,Stuart,puppo,2193,14818,https://pbs.twimg.com/media/DFg_2PVW0AEHN3p.jpg,1,golden_retriever,0.953442,True,Labrador_retriever,0.0138341,True,redbone,0.00795775,True
94,889278841981685760,nan,nan,2017-07-24 00:19:32,Twitter for iPhone,This is Oliver. You're witnessing one of his many brutal attacks. Seems to be playing with his victim. 13/10 fr*ckin frightening #BarkWeek https://t.co/WpHvrQedPb,https://twitter.com/dog_rates/status/889278841981685760/video/1,13.0,10.0,Oliver,,5238,24750,https://pbs.twimg.com/ext_tw_video_thumb/889278779352338437/pu/img/VlbFB3v8H8VwzVNY.jpg,1,whippet,0.626152,True,borzoi,0.194742,True,Saluki,0.0273507,True
100,888917238123831296,nan,nan,2017-07-23 00:22:39,Twitter for iPhone,This is Jim. He found a fren. Taught him how to sit like the good boys. 12/10 for both https://t.co/chxruIOUJN,https://twitter.com/dog_rates/status/888917238123831296/photo/1,12.0,10.0,Jim,,4397,28535,https://pbs.twimg.com/media/DFYRgsOUQAARGhO.jpg,1,golden_retriever,0.714719,True,Tibetan_mastiff,0.120184,True,Labrador_retriever,0.105506,True
105,888804989199671297,nan,nan,2017-07-22 16:56:37,Twitter for iPhone,This is Zeke. He has a new stick. Very proud of it. Would like you to throw it for him without taking it. 13/10 would do my best https://t.co/HTQ77yNQ5K,"https://twitter.com/dog_rates/status/888804989199671297/photo/1,https://twitter.com/dog_rates/status/888804989199671297/photo/1",13.0,10.0,Zeke,,4189,25066,https://pbs.twimg.com/media/DFWra-3VYAA2piG.jpg,1,golden_retriever,0.46976,True,Labrador_retriever,0.184172,True,English_setter,0.0734817,True
106,888804989199671297,nan,nan,2017-07-22 16:56:37,Twitter for iPhone,This is Zeke. He has a new stick. Very proud of it. Would like you to throw it for him without taking it. 13/10 would do my best https://t.co/HTQ77yNQ5K,"https://twitter.com/dog_rates/status/888804989199671297/photo/1,https://twitter.com/dog_rates/status/888804989199671297/photo/1",13.0,10.0,Zeke,,4182,25059,https://pbs.twimg.com/media/DFWra-3VYAA2piG.jpg,1,golden_retriever,0.46976,True,Labrador_retriever,0.184172,True,English_setter,0.0734817,True
111,888554962724278272,nan,nan,2017-07-22 00:23:06,Twitter for iPhone,This is Ralphus. He's powering up. Attempting maximum borkdrive. 13/10 inspirational af https://t.co/YnYAFCTTiK,"https://twitter.com/dog_rates/status/888554962724278272/photo/1,https://twitter.com/dog_rates/status/888554962724278272/photo/1,https://twitter.com/dog_rates/status/888554962724278272/photo/1,https://twitter.com/dog_rates/status/888554962724278272/photo/1",13.0,10.0,Ralphus,,3465,19442,https://pbs.twimg.com/media/DFTH_O-UQAACu20.jpg,3,Siberian_husky,0.700377,True,Eskimo_dog,0.166511,True,malamute,0.111411,True
112,888554962724278272,nan,nan,2017-07-22 00:23:06,Twitter for iPhone,This is Ralphus. He's powering up. Attempting maximum borkdrive. 13/10 inspirational af https://t.co/YnYAFCTTiK,"https://twitter.com/dog_rates/status/888554962724278272/photo/1,https://twitter.com/dog_rates/status/888554962724278272/photo/1,https://twitter.com/dog_rates/status/888554962724278272/photo/1,https://twitter.com/dog_rates/status/888554962724278272/photo/1",13.0,10.0,Ralphus,,3461,19432,https://pbs.twimg.com/media/DFTH_O-UQAACu20.jpg,3,Siberian_husky,0.700377,True,Eskimo_dog,0.166511,True,malamute,0.111411,True
118,888078434458587136,nan,nan,2017-07-20 16:49:33,Twitter for iPhone,This is Gerald. He was just told he didn't get the job he interviewed for. A h*ckin injustice. 12/10 didn't want the job anyway https://t.co/DK7iDPfuRX,"https://twitter.com/dog_rates/status/888078434458587136/photo/1,https://twitter.com/dog_rates/status/888078434458587136/photo/1",12.0,10.0,Gerald,,3409,21326,https://pbs.twimg.com/media/DFMWn56WsAAkA7B.jpg,1,French_bulldog,0.995026,True,pug,0.000931908,True,bull_mastiff,0.000903211,True
124,887705289381826560,nan,nan,2017-07-19 16:06:48,Twitter for iPhone,This is Jeffrey. He has a monopoly on the pool noodles. Currently running a 'boop for two' midweek sale. 13/10 h*ckin strategic https://t.co/PhrUk20Q64,https://twitter.com/dog_rates/status/887705289381826560/photo/1,13.0,10.0,Jeffrey,,5265,29579,https://pbs.twimg.com/media/DFHDQBbXgAEqY7t.jpg,1,basset,0.821664,True,redbone,0.0875815,True,Weimaraner,0.026236400000000003,True
129,887517139158093824,nan,nan,2017-07-19 03:39:09,Twitter for iPhone,I've yet to rate a Venezuelan Hover Wiener. This is such an honor. 14/10 paw-inspiring af (IG: roxy.thedoxy) https://t.co/20VrLAA8ba,https://twitter.com/dog_rates/status/887517139158093824/video/1,14.0,10.0,NaN,,11413,45378,https://pbs.twimg.com/ext_tw_video_thumb/887517108413886465/pu/img/WanJKwssZj4VJvL9.jpg,1,limousine,0.130432,False,tow_truck,0.0291754,False,shopping_cart,0.0263208,False
130,887517139158093824,nan,nan,2017-07-19 03:39:09,Twitter for iPhone,I've yet to rate a Venezuelan Hover Wiener. This is such an honor. 14/10 paw-inspiring af (IG: roxy.thedoxy) https://t.co/20VrLAA8ba,https://twitter.com/dog_rates/status/887517139158093824/video/1,14.0,10.0,NaN,,11405,45358,https://pbs.twimg.com/ext_tw_video_thumb/887517108413886465/pu/img/WanJKwssZj4VJvL9.jpg,1,limousine,0.130432,False,tow_truck,0.0291754,False,shopping_cart,0.0263208,False
134,887473957103951883,nan,nan,2017-07-19 00:47:34,Twitter for iPhone,This is Canela. She attempted some fancy porch pics. They were unsuccessful. 13/10 someone help her https://t.co/cLyzpcUcMX,"https://twitter.com/dog_rates/status/887473957103951883/photo/1,https://twitter.com/dog_rates/status/887473957103951883/photo/1",13.0,10.0,Canela,,17753,67673,https://pbs.twimg.com/media/DFDw2tyUQAAAFke.jpg,2,Pembroke,0.809197,True,Rhodesian_ridgeback,0.05495,True,beagle,0.0389148,True
136,887473957103951883,nan,nan,2017-07-19 00:47:34,Twitter for iPhone,This is Canela. She attempted some fancy porch pics. They were unsuccessful. 13/10 someone help her https://t.co/cLyzpcUcMX,"https://twitter.com/dog_rates/status/887473957103951883/photo/1,https://twitter.com/dog_rates/status/887473957103951883/photo/1",13.0,10.0,Canela,,17742,67652,https://pbs.twimg.com/media/DFDw2tyUQAAAFke.jpg,2,Pembroke,0.809197,True,Rhodesian_ridgeback,0.05495,True,beagle,0.0389148,True
142,887343217045368832,nan,nan,2017-07-18 16:08:03,Twitter for iPhone,You may not have known you needed to see this today. 13/10 please enjoy (IG: emmylouroo) https://t.co/WZqNqygEyV,https://twitter.com/dog_rates/status/887343217045368832/video/1,13.0,10.0,NaN,,10161,33013,https://pbs.twimg.com/ext_tw_video_thumb/887343120832229379/pu/img/6HSuFrW1lzI_9Mht.jpg,1,Mexican_hairless,0.330741,True,sea_lion,0.275645,False,Weimaraner,0.134203,True
148,887101392804085760,nan,nan,2017-07-18 00:07:08,Twitter for iPhone,This... is a Jubilant Antarctic House Bear. We only rate dogs. Please only send dogs. Thank you... 12/10 would suffocate in floof https://t.co/4Ad1jzJSdp,https://twitter.com/dog_rates/status/887101392804085760/photo/1,12.0,10.0,NaN,,5816,29973,https://pbs.twimg.com/media/DE-eAq6UwAA-jaE.jpg,1,Samoyed,0.733942,True,Eskimo_dog,0.0350295,True,Staffordshire_bullterrier,0.029704700000000007,True
154,886983233522544640,nan,nan,2017-07-17 16:17:36,Twitter for iPhone,This is Maya. She's very shy. Rarely leaves her cup. 13/10 would find her an environment to thrive in https://t.co/I6oNy0CgiT,"https://twitter.com/dog_rates/status/886983233522544640/photo/1,https://twitter.com/dog_rates/status/886983233522544640/photo/1",13.0,10.0,Maya,,7585,34441,https://pbs.twimg.com/media/DE8yicJW0AAAvBJ.jpg,2,Chihuahua,0.793469,True,toy_terrier,0.143528,True,can_opener,0.0322529,False
158,886736880519319552,nan,nan,2017-07-16 23:58:41,Twitter for iPhone,"This is Mingus. He's a wonderful father to his smol pup. Confirmed 13/10, but he needs your help

https://t.co/bVi0Yr4Cff https://t.co/ISvKOSkd5b","https://www.gofundme.com/mingusneedsus,https://twitter.com/dog_rates/status/886736880519319552/photo/1,https://twitter.com/dog_rates/status/886736880519319552/photo/1",13.0,10.0,Mingus,,3207,11825,https://pbs.twimg.com/media/DE5Se8FXcAAJFx4.jpg,1,kuvasz,0.309706,True,Great_Pyrenees,0.186136,True,Dandie_Dinmont,0.08634630000000001,True
160,886736880519319552,nan,nan,2017-07-16 23:58:41,Twitter for iPhone,"This is Mingus. He's a wonderful father to his smol pup. Confirmed 13/10, but he needs your help

https://t.co/bVi0Yr4Cff https://t.co/ISvKOSkd5b","https://www.gofundme.com/mingusneedsus,https://twitter.com/dog_rates/status/886736880519319552/photo/1,https://twitter.com/dog_rates/status/886736880519319552/photo/1",13.0,10.0,Mingus,,3199,11823,https://pbs.twimg.com/media/DE5Se8FXcAAJFx4.jpg,1,kuvasz,0.309706,True,Great_Pyrenees,0.186136,True,Dandie_Dinmont,0.08634630000000001,True
165,886680336477933568,nan,nan,2017-07-16 20:14:00,Twitter for iPhone,This is Derek. He's late for a dog meeting. 13/10 pet...al to the metal https://t.co/BCoWue0abA,https://twitter.com/dog_rates/status/886680336477933568/photo/1,13.0,10.0,Derek,,4360,22002,https://pbs.twimg.com/media/DE4fEDzWAAAyHMM.jpg,1,convertible,0.738995,False,sports_car,0.139952,False,car_wheel,0.0441727,False
166,886680336477933568,nan,nan,2017-07-16 20:14:00,Twitter for iPhone,This is Derek. He's late for a dog meeting. 13/10 pet...al to the metal https://t.co/BCoWue0abA,https://twitter.com/dog_rates/status/886680336477933568/photo/1,13.0,10.0,Derek,,4357,21993,https://pbs.twimg.com/media/DE4fEDzWAAAyHMM.jpg,1,convertible,0.738995,False,sports_car,0.139952,False,car_wheel,0.0441727,False
172,886366144734445568,nan,nan,2017-07-15 23:25:31,Twitter for iPhone,This is Roscoe. Another pupper fallen victim to spontaneous tongue ejections. Get the BlepiPen immediate. 12/10 deep breaths Roscoe https://t.co/RGE08MIJox,"https://twitter.com/dog_rates/status/886366144734445568/photo/1,https://twitter.com/dog_rates/status/886366144734445568/photo/1",12.0,10.0,Roscoe,pupper,3127,20780,https://pbs.twimg.com/media/DE0BTnQUwAApKEH.jpg,1,French_bulldog,0.999201,True,Chihuahua,0.000361178,True,Boston_bull,7.55616e-05,True
177,886258384151887873,nan,nan,2017-07-15 16:17:19,Twitter for iPhone,This is Waffles. His doggles are pupside down. Unsure how to fix. 13/10 someone assist Waffles https://t.co/xZDA9Qsq1O,https://twitter.com/dog_rates/status/886258384151887873/photo/1,13.0,10.0,Waffles,,6143,27461,https://pbs.twimg.com/media/DEyfTG4UMAE4aE9.jpg,1,pug,0.943575,True,shower_cap,0.0252856,False,Siamese_cat,0.00284892,False
178,886258384151887873,nan,nan,2017-07-15 16:17:19,Twitter for iPhone,This is Waffles. His doggles are pupside down. Unsure how to fix. 13/10 someone assist Waffles https://t.co/xZDA9Qsq1O,https://twitter.com/dog_rates/status/886258384151887873/photo/1,13.0,10.0,Waffles,,6137,27446,https://pbs.twimg.com/media/DEyfTG4UMAE4aE9.jpg,1,pug,0.943575,True,shower_cap,0.0252856,False,Siamese_cat,0.00284892,False
181,885984800019947520,nan,nan,2017-07-14 22:10:11,Twitter for iPhone,Viewer discretion advised. This is Jimbo. He will rip ur finger right h*ckin off. Other dog clearly an accessory. 12/10 pls pet with caution https://t.co/BuveP0uMF1,https://twitter.com/dog_rates/status/885984800019947520/photo/1,12.0,10.0,Jimbo,,6620,32017,https://pbs.twimg.com/media/DEumeWWV0AA-Z61.jpg,1,Blenheim_spaniel,0.972494,True,Shih-Tzu,0.00663012,True,Bernese_mountain_dog,0.00623915,True
182,885984800019947520,nan,nan,2017-07-14 22:10:11,Twitter for iPhone,Viewer discretion advised. This is Jimbo. He will rip ur finger right h*ckin off. Other dog clearly an accessory. 12/10 pls pet with caution https://t.co/BuveP0uMF1,https://twitter.com/dog_rates/status/885984800019947520/photo/1,12.0,10.0,Jimbo,,6620,32019,https://pbs.twimg.com/media/DEumeWWV0AA-Z61.jpg,1,Blenheim_spaniel,0.972494,True,Shih-Tzu,0.00663012,True,Bernese_mountain_dog,0.00623915,True
183,885984800019947520,nan,nan,2017-07-14 22:10:11,Twitter for iPhone,Viewer discretion advised. This is Jimbo. He will rip ur finger right h*ckin off. Other dog clearly an accessory. 12/10 pls pet with caution https://t.co/BuveP0uMF1,https://twitter.com/dog_rates/status/885984800019947520/photo/1,12.0,10.0,Jimbo,,6620,32020,https://pbs.twimg.com/media/DEumeWWV0AA-Z61.jpg,1,Blenheim_spaniel,0.972494,True,Shih-Tzu,0.00663012,True,Bernese_mountain_dog,0.00623915,True
184,885984800019947520,nan,nan,2017-07-14 22:10:11,Twitter for iPhone,Viewer discretion advised. This is Jimbo. He will rip ur finger right h*ckin off. Other dog clearly an accessory. 12/10 pls pet with caution https://t.co/BuveP0uMF1,https://twitter.com/dog_rates/status/885984800019947520/photo/1,12.0,10.0,Jimbo,,6607,31991,https://pbs.twimg.com/media/DEumeWWV0AA-Z61.jpg,1,Blenheim_spaniel,0.972494,True,Shih-Tzu,0.00663012,True,Bernese_mountain_dog,0.00623915,True
190,885528943205470208,nan,nan,2017-07-13 15:58:47,Twitter for iPhone,This is Maisey. She fell asleep mid-excavation. Happens to the best of us. 13/10 would pat noggin approvingly https://t.co/tp1kQ8i9JF,https://twitter.com/dog_rates/status/885528943205470208/photo/1,13.0,10.0,Maisey,,6274,35269,https://pbs.twimg.com/media/DEoH3yvXgAAzQtS.jpg,1,pug,0.369275,True,Labrador_retriever,0.265835,True,kuvasz,0.134697,True
202,885167619883638784,nan,nan,2017-07-12 16:03:00,Twitter for iPhone,Here we have a corgi undercover as a malamute. Pawbably doing important investigative work. Zero control over tongue happenings. 13/10 https://t.co/44ItaMubBf,"https://twitter.com/dog_rates/status/885167619883638784/photo/1,https://twitter.com/dog_rates/status/885167619883638784/photo/1,https://twitter.com/dog_rates/status/885167619883638784/photo/1,https://twitter.com/dog_rates/status/885167619883638784/photo/1",13.0,10.0,NaN,,4279,21489,https://pbs.twimg.com/media/DEi_N9qXYAAgEEw.jpg,4,malamute,0.8124819999999999,True,Siberian_husky,0.0717125,True,Eskimo_dog,0.0557697,True
207,884925521741709313,nan,nan,2017-07-12 00:01:00,Twitter for iPhone,"This is Earl. He found a hat. Nervous about what you think of it. 12/10 it's delightful, Earl https://t.co/MYJvdlNRVa",https://twitter.com/dog_rates/status/884925521741709313/photo/1,12.0,10.0,Earl,,17846,75927,https://pbs.twimg.com/media/DEfjEaNXkAAtPlj.jpg,1,Italian_greyhound,0.259916,True,American_Staffordshire_terrier,0.198451,True,Staffordshire_bullterrier,0.127725,True
208,884925521741709313,nan,nan,2017-07-12 00:01:00,Twitter for iPhone,"This is Earl. He found a hat. Nervous about what you think of it. 12/10 it's delightful, Earl https://t.co/MYJvdlNRVa",https://twitter.com/dog_rates/status/884925521741709313/photo/1,12.0,10.0,Earl,,17828,75889,https://pbs.twimg.com/media/DEfjEaNXkAAtPlj.jpg,1,Italian_greyhound,0.259916,True,American_Staffordshire_terrier,0.198451,True,Staffordshire_bullterrier,0.127725,True
213,884876753390489601,nan,nan,2017-07-11 20:47:12,Twitter for iPhone,This is Lola. It's her first time outside. Must test the earth and taste the atmosphere. 13/10 you're doing great Lola https://t.co/74TKAUsLkO,"https://twitter.com/dog_rates/status/884876753390489601/photo/1,https://twitter.com/dog_rates/status/884876753390489601/photo/1,https://twitter.com/dog_rates/status/884876753390489601/photo/1,https://twitter.com/dog_rates/status/884876753390489601/photo/1",13.0,10.0,Lola,,5481,27381,https://pbs.twimg.com/media/DEe2tZXXkAAwyX3.jpg,1,chow,0.822103,True,Norwich_terrier,0.106075,True,Norfolk_terrier,0.0373485,True
214,884876753390489601,nan,nan,2017-07-11 20:47:12,Twitter for iPhone,This is Lola. It's her first time outside. Must test the earth and taste the atmosphere. 13/10 you're doing great Lola https://t.co/74TKAUsLkO,"https://twitter.com/dog_rates/status/884876753390489601/photo/1,https://twitter.com/dog_rates/status/884876753390489601/photo/1,https://twitter.com/dog_rates/status/884876753390489601/photo/1,https://twitter.com/dog_rates/status/884876753390489601/photo/1",13.0,10.0,Lola,,5477,27382,https://pbs.twimg.com/media/DEe2tZXXkAAwyX3.jpg,1,chow,0.822103,True,Norwich_terrier,0.106075,True,Norfolk_terrier,0.0373485,True
