,tweet_id,in_reply_to_status_id,in_reply_to_user_id,timestamp,source,text,expanded_urls,rating_numerator,rating_denominator,name,dog_stage,retweet_count,favorite_count,jpg_url,img_num,p1,p1_conf,p1_dog,p2,p2_conf,p2_dog,p3,p3_conf,p3_dog
1318,840370681858686976,nan,nan,2017-03-11 01:15:58,Twitter for iPhone,You have been visited by the magical sugar jar puggo. He has granted you three boops. 13/10 would use immediately https://t.co/76iL7JUQdG,https://twitter.com/dog_rates/status/840370681858686976/photo/1,13.0,10.0,NaN,,4842,17173,https://pbs.twimg.com/media/C6mYrK0UwAANhep.jpg,1,teapot,0.981819,False,cup,0.014025799999999998,False,coffeepot,0.00242054,False
1323,840268004936019968,nan,nan,2017-03-10 18:27:58,Twitter for iPhone,This is Monty. He makes instantly regrettable decisions. Couldn't help himself. It looked like a ghost lollipop. 12/10 mistake happen https://t.co/8Wsr6b4RjE,"https://twitter.com/dog_rates/status/840268004936019968/photo/1,https://twitter.com/dog_rates/status/840268004936019968/photo/1,https://twitter.com/dog_rates/status/840268004936019968/photo/1,https://twitter.com/dog_rates/status/840268004936019968/photo/1",12.0,10.0,Monty,,6113,20120,https://pbs.twimg.com/media/C6k7SaEXUAg83_J.jpg,3,Chesapeake_Bay_retriever,0.8639870000000001,True,Labrador_retriever,0.0526323,True,kelpie,0.0325736,True
1324,840268004936019968,nan,nan,2017-03-10 18:27:58,Twitter for iPhone,This is Monty. He makes instantly regrettable decisions. Couldn't help himself. It looked like a ghost lollipop. 12/10 mistake happen https://t.co/8Wsr6b4RjE,"https://twitter.com/dog_rates/status/840268004936019968/photo/1,https://twitter.com/dog_rates/status/840268004936019968/photo/1,https://twitter.com/dog_rates/status/840268004936019968/photo/1,https://twitter.com/dog_rates/status/840268004936019968/photo/1",12.0,10.0,Monty,,6110,20117,https://pbs.twimg.com/media/C6k7SaEXUAg83_J.jpg,3,Chesapeake_Bay_retriever,0.8639870000000001,True,Labrador_retriever,0.0526323,True,kelpie,0.0325736,True
1329,839990271299457024,nan,nan,2017-03-10 00:04:21,Twitter for iPhone,Meet Sojourner. His nose is a Fibonacci Spiral. Legendary af. 13/10 we must protect him at all costs https://t.co/r7W1NbkOtr,"https://twitter.com/dog_rates/status/839990271299457024/photo/1,https://twitter.com/dog_rates/status/839990271299457024/photo/1",13.0,10.0,Sojourner,,2449,14020,https://pbs.twimg.com/media/C6g-sX-VsAAHfJ9.jpg,2,Staffordshire_bullterrier,0.604938,True,American_Staffordshire_terrier,0.31154,True,Boston_bull,0.0371591,True
1330,839990271299457024,nan,nan,2017-03-10 00:04:21,Twitter for iPhone,Meet Sojourner. His nose is a Fibonacci Spiral. Legendary af. 13/10 we must protect him at all costs https://t.co/r7W1NbkOtr,"https://twitter.com/dog_rates/status/839990271299457024/photo/1,https://twitter.com/dog_rates/status/839990271299457024/photo/1",13.0,10.0,Sojourner,,2445,14001,https://pbs.twimg.com/media/C6g-sX-VsAAHfJ9.jpg,2,Staffordshire_bullterrier,0.604938,True,American_Staffordshire_terrier,0.31154,True,Boston_bull,0.0371591,True
1335,839549326359670784,nan,nan,2017-03-08 18:52:12,Twitter for iPhone,"Meet Winston. He knows he's a little too big for the swing, but he doesn't care. Kindly requests a push. 12/10 would happily oblige https://t.co/GuxEXTdnMu",https://twitter.com/dog_rates/status/839549326359670784/photo/1,12.0,10.0,Winston,,8303,28755,https://pbs.twimg.com/media/C6atpTLWYAIL7bU.jpg,1,swing,0.393527,False,Norwich_terrier,0.05248,True,Pembroke,0.0499006,True
1336,839549326359670784,nan,nan,2017-03-08 18:52:12,Twitter for iPhone,"Meet Winston. He knows he's a little too big for the swing, but he doesn't care. Kindly requests a push. 12/10 would happily oblige https://t.co/GuxEXTdnMu",https://twitter.com/dog_rates/status/839549326359670784/photo/1,12.0,10.0,Winston,,8298,28744,https://pbs.twimg.com/media/C6atpTLWYAIL7bU.jpg,1,swing,0.393527,False,Norwich_terrier,0.05248,True,Pembroke,0.0499006,True
1348,839239871831150596,nan,nan,2017-03-07 22:22:32,Twitter for iPhone,This is Odie. He's big. 13/10 would attempt to ride https://t.co/JEXB9RwBmm,"https://twitter.com/dog_rates/status/839239871831150596/photo/1,https://twitter.com/dog_rates/status/839239871831150596/photo/1,https://twitter.com/dog_rates/status/839239871831150596/photo/1",13.0,10.0,Odie,,6974,28424,https://pbs.twimg.com/media/C6WUNadWYAAPxHv.jpg,3,Leonberg,0.927021,True,Newfoundland,0.0500091,True,Saint_Bernard,0.0107278,True
1353,838921590096166913,nan,nan,2017-03-07 01:17:48,Twitter for iPhone,This is Arlo. He's officially the king of snowy tongue slips. 13/10 would comfort during inevitable brain freeze https://t.co/oXVu9pNZZv,https://twitter.com/dog_rates/status/838921590096166913/photo/1,13.0,10.0,Arlo,,2218,11673,https://pbs.twimg.com/media/C6Ryuf7UoAAFX4a.jpg,1,Border_terrier,0.664538,True,Brabancon_griffon,0.170451,True,Yorkshire_terrier,0.08782360000000003,True
1354,838921590096166913,nan,nan,2017-03-07 01:17:48,Twitter for iPhone,This is Arlo. He's officially the king of snowy tongue slips. 13/10 would comfort during inevitable brain freeze https://t.co/oXVu9pNZZv,https://twitter.com/dog_rates/status/838921590096166913/photo/1,13.0,10.0,Arlo,,2216,11664,https://pbs.twimg.com/media/C6Ryuf7UoAAFX4a.jpg,1,Border_terrier,0.664538,True,Brabancon_griffon,0.170451,True,Yorkshire_terrier,0.08782360000000003,True
1365,838561493054533637,nan,nan,2017-03-06 01:26:54,Twitter for iPhone,This is Walter. His owner has been watching all the Iditarod coverage and is convinced Walter can be a sled dog. 13/10 Walter isn't so sure https://t.co/0av1PEehFI,https://twitter.com/dog_rates/status/838561493054533637/photo/1,13.0,10.0,Walter,,1413,11419,https://pbs.twimg.com/media/C6MrOsEXQAENOds.jpg,1,kelpie,0.216562,True,doormat,0.139994,False,dalmatian,0.13282,True
1366,838561493054533637,nan,nan,2017-03-06 01:26:54,Twitter for iPhone,This is Walter. His owner has been watching all the Iditarod coverage and is convinced Walter can be a sled dog. 13/10 Walter isn't so sure https://t.co/0av1PEehFI,https://twitter.com/dog_rates/status/838561493054533637/photo/1,13.0,10.0,Walter,,1412,11415,https://pbs.twimg.com/media/C6MrOsEXQAENOds.jpg,1,kelpie,0.216562,True,doormat,0.139994,False,dalmatian,0.13282,True
1369,838476387338051585,nan,nan,2017-03-05 19:48:43,Twitter for iPhone,This is Stanley. Somehow he heard you tell him he's a good boy from all the way up there. 13/10 I love you Stanley https://t.co/51FXNuouHI,"https://twitter.com/dog_rates/status/838476387338051585/photo/1,https://twitter.com/dog_rates/status/838476387338051585/photo/1,https://twitter.com/dog_rates/status/838476387338051585/photo/1",13.0,10.0,Stanley,,5143,23618,https://pbs.twimg.com/media/C6Ld0wYWgAQQqMC.jpg,3,Great_Pyrenees,0.997692,True,kuvasz,0.00100064,True,Newfoundland,0.000404556,True
1370,838476387338051585,nan,nan,2017-03-05 19:48:43,Twitter for iPhone,This is Stanley. Somehow he heard you tell him he's a good boy from all the way up there. 13/10 I love you Stanley https://t.co/51FXNuouHI,"https://twitter.com/dog_rates/status/838476387338051585/photo/1,https://twitter.com/dog_rates/status/838476387338051585/photo/1,https://twitter.com/dog_rates/status/838476387338051585/photo/1",13.0,10.0,Stanley,,5143,23617,https://pbs.twimg.com/media/C6Ld0wYWgAQQqMC.jpg,3,Great_Pyrenees,0.997692,True,kuvasz,0.00100064,True,Newfoundland,0.000404556,True
1371,838476387338051585,nan,nan,2017-03-05 19:48:43,Twitter for iPhone,This is Stanley. Somehow he heard you tell him he's a good boy from all the way up there. 13/10 I love you Stanley https://t.co/51FXNuouHI,"https://twitter.com/dog_rates/status/838476387338051585/photo/1,https://twitter.com/dog_rates/status/838476387338051585/photo/1,https://twitter.com/dog_rates/status/838476387338051585/photo/1",13.0,10.0,Stanley,,5142,23617,https://pbs.twimg.com/media/C6Ld0wYWgAQQqMC.jpg,3,Great_Pyrenees,0.997692,True,kuvasz,0.00100064,True,Newfoundland,0.000404556,True
1372,838476387338051585,nan,nan,2017-03-05 19:48:43,Twitter for iPhone,This is Stanley. Somehow he heard you tell him he's a good boy from all the way up there. 13/10 I love you Stanley https://t.co/51FXNuouHI,"https://twitter.com/dog_rates/status/838476387338051585/photo/1,https://twitter.com/dog_rates/status/838476387338051585/photo/1,https://twitter.com/dog_rates/status/838476387338051585/photo/1",13.0,10.0,Stanley,,5137,23606,https://pbs.twimg.com/media/C6Ld0wYWgAQQqMC.jpg,3,Great_Pyrenees,0.997692,True,kuvasz,0.00100064,True,Newfoundland,0.000404556,True
1378,838083903487373313,nan,nan,2017-03-04 17:49:08,Twitter for iPhone,This is Daisy. She's puppears to be rare as all h*ck. Only seven like her currently domesticated. 13/10 pettable af https://t.co/meUc8jufAO,"https://twitter.com/dog_rates/status/838083903487373313/photo/1,https://twitter.com/dog_rates/status/838083903487373313/photo/1",13.0,10.0,Daisy,,3371,18435,https://pbs.twimg.com/media/C6F42cGUYAAIKsX.jpg,2,chow,0.800975,True,seat_belt,0.164133,False,Pomeranian,0.017981,True
1383,837820167694528512,nan,nan,2017-03-04 00:21:08,Twitter for iPhone,"Here's a pupper before and after being asked ""who's a good girl?"" Unsure as h*ck. 12/10 hint hint it's you https://t.co/ORiK6jlgdH","https://twitter.com/dog_rates/status/837820167694528512/photo/1,https://twitter.com/dog_rates/status/837820167694528512/photo/1",12.0,10.0,NaN,pupper,8394,35788,https://pbs.twimg.com/media/C6CI_jbVAAA3-a1.jpg,1,golden_retriever,0.887625,True,Labrador_retriever,0.0687175,True,kuvasz,0.0303868,True
1384,837820167694528512,nan,nan,2017-03-04 00:21:08,Twitter for iPhone,"Here's a pupper before and after being asked ""who's a good girl?"" Unsure as h*ck. 12/10 hint hint it's you https://t.co/ORiK6jlgdH","https://twitter.com/dog_rates/status/837820167694528512/photo/1,https://twitter.com/dog_rates/status/837820167694528512/photo/1",12.0,10.0,NaN,pupper,8391,35771,https://pbs.twimg.com/media/C6CI_jbVAAA3-a1.jpg,1,golden_retriever,0.887625,True,Labrador_retriever,0.0687175,True,kuvasz,0.0303868,True
1390,837482249356513284,nan,nan,2017-03-03 01:58:22,Twitter for iPhone,This is Waffles. He's a ship captain in real life and in @GoodDogsGame. Must've gotten to the max level (wink) 13/10 would sail with https://t.co/Z3LAaV2pKz,"https://twitter.com/dog_rates/status/837482249356513284/photo/1,https://twitter.com/dog_rates/status/837482249356513284/photo/1",13.0,10.0,Waffles,,471,4011,https://pbs.twimg.com/media/C59VqMUXEAAzldG.jpg,2,birdhouse,0.541196,False,can_opener,0.121094,False,carton,0.0561367,False
1396,837471256429613056,nan,nan,2017-03-03 01:14:41,Twitter for iPhone,This is Vincent. He's suave as h*ck. Will be your copilot this evening. Claims he doesn't need to look at the directions. 12/10 https://t.co/u51tzXSVi3,"https://twitter.com/dog_rates/status/837471256429613056/photo/1,https://twitter.com/dog_rates/status/837471256429613056/photo/1",12.0,10.0,Vincent,,2449,13378,https://pbs.twimg.com/media/C59LpELWUAEUmYh.jpg,1,Norwegian_elkhound,0.976255,True,keeshond,0.0139902,True,seat_belt,0.00211054,False
1402,837366284874571778,nan,nan,2017-03-02 18:17:34,Twitter for iPhone,This is Lucy. She has a portrait of herself on her ear. Excellent for identification pupposes. 13/10 innovative af https://t.co/uNmxbL2lns,https://twitter.com/dog_rates/status/837366284874571778/photo/1,13.0,10.0,Lucy,puppo,5660,22121,https://pbs.twimg.com/media/C57sMJwXMAASBSx.jpg,1,American_Staffordshire_terrier,0.660085,True,Staffordshire_bullterrier,0.334947,True,dalmatian,0.00269716,True
1407,837110210464448512,nan,nan,2017-03-02 01:20:01,Twitter for iPhone,This is Clark. He passed pupper training today. Round of appaws for Clark. 13/10 https://t.co/7pUjwe8X6B,https://twitter.com/dog_rates/status/837110210464448512/photo/1,13.0,10.0,Clark,pupper,2559,16779,https://pbs.twimg.com/media/C54DS1kXQAEU5pS.jpg,1,Siberian_husky,0.767696,True,Eskimo_dog,0.217079,True,malamute,0.0116568,True
1408,837110210464448512,nan,nan,2017-03-02 01:20:01,Twitter for iPhone,This is Clark. He passed pupper training today. Round of appaws for Clark. 13/10 https://t.co/7pUjwe8X6B,https://twitter.com/dog_rates/status/837110210464448512/photo/1,13.0,10.0,Clark,pupper,2554,16767,https://pbs.twimg.com/media/C54DS1kXQAEU5pS.jpg,1,Siberian_husky,0.767696,True,Eskimo_dog,0.217079,True,malamute,0.0116568,True
1414,836989968035819520,nan,nan,2017-03-01 17:22:13,Twitter for iPhone,This is Mookie. He really enjoys shopping but not from such high altitudes. Doin him quite the concern. 12/10 someone lower him https://t.co/beWUzGVKRM,https://twitter.com/dog_rates/status/836989968035819520/photo/1,12.0,10.0,Mookie,,2458,13316,https://pbs.twimg.com/media/C52V7PzWcAA_pVv.jpg,1,shopping_cart,0.572422,False,shopping_basket,0.414002,False,toy_poodle,0.005887300000000001,True
1420,836753516572119041,nan,nan,2017-03-01 01:42:39,Twitter for iPhone,This is Meera. She just heard about taxes and how much a doghouse in a nice area costs. Not pupared to be a  doggo anymore. 12/10 https://t.co/GZmNEdyoJY,https://twitter.com/dog_rates/status/836753516572119041/photo/1,12.0,10.0,Meera,doggo,4934,20124,https://pbs.twimg.com/media/C5y-4VwWcAIcaoj.jpg,1,mortarboard,0.936882,False,academic_gown,0.0208154,False,schipperke,0.0115635,True
1426,836677758902222849,nan,nan,2017-02-28 20:41:37,Twitter for iPhone,Say hello to Oliver. He's pretty exotic. Fairly pupset as well. Too many midterms coming pup. 11/10 would pet with extreme caution https://t.co/fGAPAsxjKs,"https://twitter.com/dog_rates/status/836677758902222849/photo/1,https://twitter.com/dog_rates/status/836677758902222849/photo/1",11.0,10.0,Oliver,,2374,13201,https://pbs.twimg.com/media/C5x57-TWUAEawQh.jpg,2,leopard,0.7974100000000001,False,jaguar,0.0954866,False,snow_leopard,0.0796941,False
1432,836380477523124226,nan,nan,2017-02-28 01:00:19,Twitter for iPhone,"This is Ava. She just blasted off. Streamline af. Aerodynamic as h*ck. One small step for pupper, one giant leap for pupkind. 12/10 https://t.co/W4KffrdX3Q",https://twitter.com/dog_rates/status/836380477523124226/photo/1,12.0,10.0,Ava,pupper,3174,15430,https://pbs.twimg.com/media/C5trm6iWgAQ22Hw.jpg,1,wooden_spoon,0.08248860000000001,False,sliding_door,0.0610165,False,grand_piano,0.0550861,False
1435,836260088725786625,nan,nan,2017-02-27 17:01:56,Twitter for iPhone,This is Lucy. She spent all morning overseeing the shoveling of the driveway. H*ckin hard work. 13/10 very good girl Lucy https://t.co/gA2GECjiQD,https://twitter.com/dog_rates/status/836260088725786625/photo/1,13.0,10.0,Lucy,,4596,22273,https://pbs.twimg.com/media/C5r-G2IUwAA6KBY.jpg,1,borzoi,0.564688,True,ice_bear,0.07826749999999999,False,Pembroke,0.0579162,True
1438,836260088725786625,nan,nan,2017-02-27 17:01:56,Twitter for iPhone,This is Lucy. She spent all morning overseeing the shoveling of the driveway. H*ckin hard work. 13/10 very good girl Lucy https://t.co/gA2GECjiQD,https://twitter.com/dog_rates/status/836260088725786625/photo/1,13.0,10.0,Lucy,,4593,22269,https://pbs.twimg.com/media/C5r-G2IUwAA6KBY.jpg,1,borzoi,0.564688,True,ice_bear,0.07826749999999999,False,Pembroke,0.0579162,True
1443,836001077879255040,nan,nan,2017-02-26 23:52:43,Twitter for iPhone,Atlas is back and this time he's prettier than the sunset. Seems to be aware of it too. 13/10 would give modeling contract https://t.co/uRdKlFArQE,"https://twitter.com/dog_rates/status/836001077879255040/photo/1,https://twitter.com/dog_rates/status/836001077879255040/photo/1,https://twitter.com/dog_rates/status/836001077879255040/photo/1,https://twitter.com/dog_rates/status/836001077879255040/photo/1",13.0,10.0,NaN,,4596,20013,https://pbs.twimg.com/media/C5oSiskU0AE8sJ_.jpg,4,Samoyed,0.963558,True,white_wolf,0.0198476,False,malamute,0.00590434,True
1444,836001077879255040,nan,nan,2017-02-26 23:52:43,Twitter for iPhone,Atlas is back and this time he's prettier than the sunset. Seems to be aware of it too. 13/10 would give modeling contract https://t.co/uRdKlFArQE,"https://twitter.com/dog_rates/status/836001077879255040/photo/1,https://twitter.com/dog_rates/status/836001077879255040/photo/1,https://twitter.com/dog_rates/status/836001077879255040/photo/1,https://twitter.com/dog_rates/status/836001077879255040/photo/1",13.0,10.0,NaN,,4592,20001,https://pbs.twimg.com/media/C5oSiskU0AE8sJ_.jpg,4,Samoyed,0.963558,True,white_wolf,0.0198476,False,malamute,0.00590434,True
1450,835574547218894849,nan,nan,2017-02-25 19:37:50,Twitter for iPhone,This is Eli. He works backstage at Bone Jovi concerts. Heavy duty earmuffs for puptection. H*ckin safe boy. 11/10 https://t.co/cVQEnUQd8q,"https://twitter.com/dog_rates/status/835574547218894849/photo/1,https://twitter.com/dog_rates/status/835574547218894849/photo/1",11.0,10.0,Eli,,3878,18648,https://pbs.twimg.com/media/C5iOnigWcAAU3Ry.jpg,1,Staffordshire_bullterrier,0.6106550000000001,True,muzzle,0.132138,False,American_Staffordshire_terrier,0.109544,True
1455,835297930240217089,nan,nan,2017-02-25 01:18:40,Twitter for iPhone,Meet Ash. He's a Benebop Cumberplop. Quite rare. Fairly portable. Lil sandy tho. Clearly knows something you don't. 12/10 would hug softly https://t.co/1U0z6r5LSO,https://twitter.com/dog_rates/status/835297930240217089/photo/1,12.0,10.0,Ash,,3220,17224,https://pbs.twimg.com/media/C5eTCOVUsAAWhvc.jpg,1,Rottweiler,0.341276,True,Border_terrier,0.33622,True,Gordon_setter,0.0454483,True
1456,835297930240217089,nan,nan,2017-02-25 01:18:40,Twitter for iPhone,Meet Ash. He's a Benebop Cumberplop. Quite rare. Fairly portable. Lil sandy tho. Clearly knows something you don't. 12/10 would hug softly https://t.co/1U0z6r5LSO,https://twitter.com/dog_rates/status/835297930240217089/photo/1,12.0,10.0,Ash,,3215,17206,https://pbs.twimg.com/media/C5eTCOVUsAAWhvc.jpg,1,Rottweiler,0.341276,True,Border_terrier,0.33622,True,Gordon_setter,0.0454483,True
1462,835264098648616962,nan,nan,2017-02-24 23:04:14,Twitter for iPhone,"Meet Lola. Her hobbies include being precious af and using her foot as a toothbrush. 12/10 Lola requests your help

https://t.co/FYFyHh7rir https://t.co/IiB7ggduoU","https://www.gofundme.com/lolas-life-saving-surgery-funds,https://twitter.com/dog_rates/status/835264098648616962/photo/1,https://twitter.com/dog_rates/status/835264098648616962/photo/1",12.0,10.0,Lola,,1824,8107,https://pbs.twimg.com/media/C5d0QtvXMAI_7uz.jpg,2,hyena,0.736871,False,Chesapeake_Bay_retriever,0.0875033,True,meerkat,0.042057800000000006,False
1467,835172783151792128,nan,nan,2017-02-24 17:01:22,Twitter for iPhone,We only rate dogs. Please don't send in any non-canines like this Floppy Tongued House Panda. Thank you... 12/10 would still pet https://t.co/8fX2VkExnL,"https://twitter.com/dog_rates/status/835172783151792128/photo/1,https://twitter.com/dog_rates/status/835172783151792128/photo/1",12.0,10.0,NaN,,6152,27409,https://pbs.twimg.com/media/C5chM_jWAAQmov9.jpg,2,Border_collie,0.663138,True,collie,0.15249400000000002,True,Cardigan,0.0354706,True
1468,835172783151792128,nan,nan,2017-02-24 17:01:22,Twitter for iPhone,We only rate dogs. Please don't send in any non-canines like this Floppy Tongued House Panda. Thank you... 12/10 would still pet https://t.co/8fX2VkExnL,"https://twitter.com/dog_rates/status/835172783151792128/photo/1,https://twitter.com/dog_rates/status/835172783151792128/photo/1",12.0,10.0,NaN,,6146,27392,https://pbs.twimg.com/media/C5chM_jWAAQmov9.jpg,2,Border_collie,0.663138,True,collie,0.15249400000000002,True,Cardigan,0.0354706,True
1474,835152434251116546,nan,nan,2017-02-24 15:40:31,Twitter for iPhone,When you're so blinded by your systematic plagiarism that you forget what day it is. 0/10 https://t.co/YbEJPkg4Ag,"https://twitter.com/dog_rates/status/835152434251116546/photo/1,https://twitter.com/dog_rates/status/835152434251116546/photo/1,https://twitter.com/dog_rates/status/835152434251116546/photo/1",0.0,10.0,NaN,,3235,23548,https://pbs.twimg.com/media/C5cOtWVWMAEjO5p.jpg,3,swing,0.967066,False,American_Staffordshire_terrier,0.0127309,True,Staffordshire_bullterrier,0.00703922,True
1480,834931633769889797,nan,nan,2017-02-24 01:03:08,Twitter for iPhone,This is Tucker. He decided it was time to part ways with his favorite ball. We captured the emotional farewell on camera. 12/10 https://t.co/jTe7Y6P0HK,"https://twitter.com/dog_rates/status/834931633769889797/photo/1,https://twitter.com/dog_rates/status/834931633769889797/photo/1,https://twitter.com/dog_rates/status/834931633769889797/photo/1",12.0,10.0,Tucker,,1766,11353,https://pbs.twimg.com/media/C5ZF4p-XEAEmApg.jpg,1,ice_bear,0.330573,False,soft-coated_wheaten_terrier,0.196476,True,Irish_terrier,0.07309650000000001,True
1485,834786237630337024,nan,nan,2017-02-23 15:25:23,Twitter for iPhone,This is Tobi. She is properly fetching her shot. H*ckin nifty af bandana. 13/10 would send fully armed battalion to remind her of my love https://t.co/3FIqvumEXE,https://twitter.com/dog_rates/status/834786237630337024/photo/1,13.0,10.0,Tobi,,5891,22230,https://pbs.twimg.com/media/C5XBp19WYAA5a_v.jpg,1,Border_terrier,0.156276,True,Norwegian_elkhound,0.125912,True,Boston_bull,0.0966239,True
1486,834786237630337024,nan,nan,2017-02-23 15:25:23,Twitter for iPhone,This is Tobi. She is properly fetching her shot. H*ckin nifty af bandana. 13/10 would send fully armed battalion to remind her of my love https://t.co/3FIqvumEXE,https://twitter.com/dog_rates/status/834786237630337024/photo/1,13.0,10.0,Tobi,,5888,22226,https://pbs.twimg.com/media/C5XBp19WYAA5a_v.jpg,1,Border_terrier,0.156276,True,Norwegian_elkhound,0.125912,True,Boston_bull,0.0966239,True
1492,834574053763584002,nan,nan,2017-02-23 01:22:14,Twitter for iPhone,Here's a doggo fully pupared for a shower. H*ckin exquisite balance. Sneaky tongue slip too. 13/10 https://t.co/UtEVnQ1ZPg,https://twitter.com/dog_rates/status/834574053763584002/photo/1,13.0,10.0,NaN,doggo,2716,14344,https://pbs.twimg.com/media/C5UAqgyXAAAbMWH.jpg,1,toilet_tissue,0.262936,False,golden_retriever,0.226564,True,bathtub,0.07887899999999999,False
1497,834458053273591808,nan,nan,2017-02-22 17:41:18,Twitter for iPhone,"Meet Chester (bottom) & Harold (top). They are different dogs not only in appearance, but in personality as well. Both 12/10 symbiotic af https://t.co/8ZOZS2FSJe",https://twitter.com/dog_rates/status/834458053273591808/photo/1,12.0,10.0,Chester,,1800,10082,https://pbs.twimg.com/media/C5SXK89XUAQg7GX.jpg,1,Rhodesian_ridgeback,0.468619,True,whippet,0.177531,True,redbone,0.106552,True
1498,834458053273591808,nan,nan,2017-02-22 17:41:18,Twitter for iPhone,"Meet Chester (bottom) & Harold (top). They are different dogs not only in appearance, but in personality as well. Both 12/10 symbiotic af https://t.co/8ZOZS2FSJe",https://twitter.com/dog_rates/status/834458053273591808/photo/1,12.0,10.0,Chester,,1798,10071,https://pbs.twimg.com/media/C5SXK89XUAQg7GX.jpg,1,Rhodesian_ridgeback,0.468619,True,whippet,0.177531,True,redbone,0.106552,True
1503,834209720923721728,nan,nan,2017-02-22 01:14:30,Twitter for iPhone,This is Wilson. He's aware that he has something on his face. Waiting for you to get it for him. 12/10 https://t.co/FaeinVjzTZ,"https://twitter.com/dog_rates/status/834209720923721728/photo/1,https://twitter.com/dog_rates/status/834209720923721728/photo/1",12.0,10.0,Wilson,,5133,21628,https://pbs.twimg.com/media/C5O1UAaWIAAMBMd.jpg,1,golden_retriever,0.754799,True,Pekinese,0.197861,True,Labrador_retriever,0.00865404,True
1504,834209720923721728,nan,nan,2017-02-22 01:14:30,Twitter for iPhone,This is Wilson. He's aware that he has something on his face. Waiting for you to get it for him. 12/10 https://t.co/FaeinVjzTZ,"https://twitter.com/dog_rates/status/834209720923721728/photo/1,https://twitter.com/dog_rates/status/834209720923721728/photo/1",12.0,10.0,Wilson,,5128,21616,https://pbs.twimg.com/media/C5O1UAaWIAAMBMd.jpg,1,golden_retriever,0.754799,True,Pekinese,0.197861,True,Labrador_retriever,0.00865404,True
1510,834167344700198914,nan,nan,2017-02-21 22:26:07,Twitter for iPhone,This is Sunshine. She doesn't believe in personal space. Eyes pretty far apart for a dog. Has horns (whoa). 11/10 would pet with wonder https://t.co/o3bhLguymB,https://twitter.com/dog_rates/status/834167344700198914/photo/1,11.0,10.0,Sunshine,,3900,16531,https://pbs.twimg.com/media/C5OOxY6WAAAxERz.jpg,1,ox,0.991682,False,bison,0.00533452,False,water_buffalo,0.00113025,False
1515,834086379323871233,nan,nan,2017-02-21 17:04:24,Twitter for iPhone,This is Lipton. He's a West Romanian Snuggle Pup. Only a few left of his kind. 12/10 would boop https://t.co/5KmXPIGgAG,https://twitter.com/dog_rates/status/834086379323871233/photo/1,12.0,10.0,Lipton,,2382,13712,https://pbs.twimg.com/media/C5NFIsjWQAEI93t.jpg,1,bath_towel,0.736759,False,sleeping_bag,0.0629591,False,Labrador_retriever,0.0452627,True
1516,834086379323871233,nan,nan,2017-02-21 17:04:24,Twitter for iPhone,This is Lipton. He's a West Romanian Snuggle Pup. Only a few left of his kind. 12/10 would boop https://t.co/5KmXPIGgAG,https://twitter.com/dog_rates/status/834086379323871233/photo/1,12.0,10.0,Lipton,,2380,13708,https://pbs.twimg.com/media/C5NFIsjWQAEI93t.jpg,1,bath_towel,0.736759,False,sleeping_bag,0.0629591,False,Labrador_retriever,0.0452627,True
1521,833863086058651648,nan,nan,2017-02-21 02:17:06,Twitter for iPhone,This is Bentley. Hairbrushes are his favorite thing in the h*ckin world. 12/10 impawsible to say no to https://t.co/HDloTYilWZ,"https://twitter.com/dog_rates/status/833863086058651648/photo/1,https://twitter.com/dog_rates/status/833863086058651648/photo/1",12.0,10.0,Bentley,,2581,14076,https://pbs.twimg.com/media/C5J6DIpWQAEosSz.jpg,1,kuvasz,0.494969,True,Great_Pyrenees,0.312632,True,golden_retriever,0.141736,True
